{
    "ipv4_addresses": [
        "10.0.0.1",
        "10.0.0.1/32",
        "8.8.8.8",
        "100::1",
        "100::1/128"
    ],
    "ipv4_private_addresses": [
        "10.0.0.1",
        "10.0.0.1/32",
        "8.8.8.8",
        "100::1",
        "100::1/128"
    ],
    "ipv4_public_addresses": [
        "10.0.0.1",
        "10.0.0.1/32",
        "8.8.8.8",
        "100::1",
        "100::1/128"
    ],
    "ipv4_multicast_addresses": [
        "10.0.0.1",
        "10.0.0.1/32",
        "8.8.8.8",
        "100::1",
        "100::1/128"
    ],

    "ipv4_addresses_wplen": [
        "10.0.0.1",
        "10.0.0.1/32",
        "8.8.8.8",
        "100::1",
        "100::1/128"
    ],
    "ipv4_private_addresses_wplen": [
        "10.0.0.1",
        "10.0.0.1/32",
        "8.8.8.8",
        "100::1",
        "100::1/128"
    ],
    "ipv4_public_addresses_wplen": [
        "10.0.0.1",
        "10.0.0.1/32",
        "8.8.8.8",
        "100::1",
        "100::1/128"
    ],
    "ipv4_multicast_addresses_wplen": [
        "10.0.0.1",
        "10.0.0.1/32",
        "8.8.8.8",
        "100::1",
        "100::1/128"
    ]
}